{
  "contact_company_id": "1234567890123456",
  "created_time": 1555482457,
  "entity_type": "contact_entity",
  "id": 1234567890123456,
  "is_lead_converted": false,
  "klout_score": "",
  "last_called": 0,
  "last_campaign_emaild": 0,
  "last_contacted": 0,
  "last_emailed": 0,
  "lead_converted_time": 0,
  "lead_score": 0,
  "lead_source_id": 0,
  "lead_status_id": 0,
  "owner": {
    "calendarURL": "<URL>",
    "calendar_url": "<URL>",
    "domain": "<DOMAIN>",
    "email": "<OWNER_EMAIL>",
    "id": 1234567890123456,
    "name": "<OWNER_NAME>",
    "phone": "<OWNER_PHONE>",
    "pic": "<URI>",
    "schedule_id": "<SCHEDULE_ID>"
  },
  "properties": [
    {
      "name": "email",
      "subtype": "home",
      "type": "SYSTEM",
      "value": "<VALUE>"
    }
  ],
  "star_value": 0,
  "tags": [
    "<tag1>",
    "<tag2>"
  ],
  "type": "PERSON",
  "updated_time": 0,
  "viewed_time": 0
}